{
  "$schema": "https://schema.evideris.com/schemas/references.schema.json",
  "$id": "https://schema.evideris.com/esge/curriculum/esd-2019/references.v1.0.0.json",
  "lineageId": "refs-cur-esd-2019",
  "type": "references",
  "version": "1.0.0",
  "release": "r2026.07",
  "language": [
    "en"
  ],
  "forCurriculum": "cur-esd-2019",
  "_meta": {
    "provenance": {
      "type": "verbatim",
      "source_doi": "10.1055/a-0996-0912"
    },
    "encodedBy": "claude:esge-curriculum-autoupdate@v0.1.0",
    "encodedAt": "2026-06-27"
  },
  "references": [
    {
      "id": "ref-1",
      "citation": "Ribeiro-Mourao F, Pimentel-Nunes P, Dinis-Ribeiro M. Endoscopic submucosal dissection for gastric lesions: results of an European inquiry. Endoscopy 2010; 42: 814 \u2013 819. doi:10.1055/s-0030-1255778",
      "doi": "10.1055/s-0030-1255778",
      "lowConfidence": true,
      "confidenceIssues": [
        "surname 'Ribeiro-Mourao' not in match authors ['ribeiro-mour\u00e3o', 'pimentel-nunes', 'dinis-ribeiro']"
      ]
    },
    {
      "id": "ref-2",
      "citation": "Cao Y, Liao C, Tan A et al. Meta-analysis of endoscopic submucosal dissection versus endoscopic mucosal resection for tumors of the gastrointestinal tract. Endoscopy 2009; 41: 751 \u2013 757. doi:10.1055/s-0029-1215053",
      "doi": "10.1055/s-0029-1215053"
    },
    {
      "id": "ref-3",
      "citation": "Parra-Blanco A, Gonzalez N, Arnau MR. Ex vivo and in vivo models for endoscopic submucosal dissection training. Clin Endosc 2012; 45: 350 \u2013 357. doi:10.5946/ce.2012.45.4.350",
      "doi": "10.5946/ce.2012.45.4.350"
    },
    {
      "id": "ref-4",
      "citation": "Dumonceau JM, Hassan C, Riphaus A et al. European Society of Gastrointestinal Endoscopy (ESGE) Guideline Development Policy. Endoscopy 2012; 44: 626 \u2013 629. doi:10.1055/s-0031-1291747",
      "doi": "10.1055/s-0031-1291747"
    },
    {
      "id": "ref-5",
      "citation": "Bisschops R, Dekker E, East JE et al. European Society of Gastrointestinal Endoscopy (ESGE) curricula development for postgraduate training in advanced endoscopic procedures: rationale and methodology. Endoscopy 2019: doi:10.1055/a-1000-5603",
      "doi": "10.1055/a-1000-5603"
    },
    {
      "id": "ref-6",
      "citation": "Pimentel-Nunes P, Dinis-Ribeiro M, Ponchon T et al. Endoscopic submucosal dissection: European Society of Gastrointestinal Endoscopy (ESGE) Guideline. Endoscopy 2015; 47: 829 \u2013 854. doi:10.1055/s-0034-1392882",
      "doi": "10.1055/s-0034-1392882"
    },
    {
      "id": "ref-7",
      "citation": "Dinis-Ribeiro M, Areia M, de Vries AC et al. Management of precancerous conditions and lesions in the stomach (MAPS): guideline from the European Society of Gastrointestinal Endoscopy (ESGE), European Helicobacter Study Group (EHSG), European Society of Pathology (ESP), and the Sociedade Portuguesa de Endoscopia Digestiva (SPED). Endoscopy 2012; 44: 74 \u2013 94. doi:10.1016/j.ypat.2012.11.046",
      "doi": "10.1016/j.ypat.2012.11.046",
      "lowConfidence": true,
      "confidenceIssues": [
        "surname 'Dinis-Ribeiro' not in match authors ['lam-himlin']"
      ]
    },
    {
      "id": "ref-8",
      "citation": "Ferlitsch M, Moss A, Hassan C et al. Colorectal polypectomy and endoscopic mucosal resection (EMR): European Society of Gastrointestinal Endoscopy (ESGE) Clinical Guideline. Endoscopy 2017; 49: 270 \u2013 297. doi:10.1055/s-0043-102569",
      "doi": "10.1055/s-0043-102569"
    },
    {
      "id": "ref-9",
      "citation": "Endoscopic Classification Review Group. Update on the Paris classification of superficial neoplastic lesions in the digestive tract. Endoscopy 2005; 37: 570 \u2013 578 another, this ESGE curriculum states a quality threshold for ESD in animal models of an en bloc complete resection rate above 80 % and no perforations in the last 10 consecutive procedures before starting human procedures. Once an endoscopist has started performing ESD in humans, ESGE also highlights the need to audit ESD procedures to monitor quality and safety. Throughout this ESGE curriculum, areas where further research is required to answer critical questions are highlighted, providing direction for researchers to design future studies. We look forward to the opportunity to incorporate the results of such studies into updates of this curriculum in the years to come. Disclaimer ESGE Position Statements represent a consensus of best practice based on the available evidence at the time of preparation. This is NOT a guideline but a proposal for training in ESD. The statements may not apply in all situations and should be interpreted in the light of specific clinical situations and resource availability. Further controlled clinical studies may be needed to clarify aspects of these statements, and revision may be necessary as new data appear. Clinical considerations may justify a course of action at variance with these recommendations. This ESGE Position Statement is intended to be an educational device to provide information that may assist endoscopists in providing care to patients. The recommendations are not rules and should not be construed as establishing a legal standard of care or as encouraging, advocating, requiring, or discouraging any particular treatment. The legal disclaimer for ESGE guidelines applies to the present position statement [4]. Acknowledgments The authors gratefully thank Arjun Koch, Diogo Lib\u00e2nio, Francisco Baldaque da Silva, George Cortas, Gianluca Esposito, Jacques Bergman, Krish Ragunath, Miguel Areia, Oliver Pech, and Ricardo Kuttner Magalh\u00e3es for participating in the voting process and for their critical review of this Curriculum. R. Bisschops is funded by the Research Foundation \u2013 Flanders. J. E. East was funded by the National Institute for Health Research (NIHR) Oxford Biomedical Research Centre. The views expressed are those of the author(s) and not necessarily those of the National Health Service, the NIHR, or the Department of Health. Pimentel-. doi:10.1053/j.gastro.2004.03.001",
      "doi": "10.1053/j.gastro.2004.03.001"
    },
    {
      "id": "ref-10",
      "citation": "Inoue H, Kaga M, Ikeda H et al. Magnification endoscopy in esophageal squamous cell carcinoma: a review of the intrapapillary capillary loop classification. Ann Gastroenterol 2015; 28: 41\u2013 48. doi:10.1055/s-0034-1390858",
      "doi": "10.1055/s-0034-1390858"
    },
    {
      "id": "ref-11",
      "citation": "Oyama T, Inoue H, Arima M et al. Prediction of the invasion depth of superficial squamous cell carcinoma based on microvessel morphology: magnifying endoscopic classification of the Japan Esophageal Society. Esophagus 2017; 14: 105 \u2013 112. doi:10.1007/s10388-016-0527-7",
      "doi": "10.1007/s10388-016-0527-7"
    },
    {
      "id": "ref-12",
      "citation": "Uraoka T, Saito Y, Ikematsu H et al. Sano's capillary pattern classification for narrow-band imaging of early colorectal lesions. Dig Endosc 2011; 23: (Suppl. 01): 112\u2013 115. doi:10.1111/j.1443-1661.2011.01118.x",
      "doi": "10.1111/j.1443-1661.2011.01118.x"
    },
    {
      "id": "ref-13",
      "citation": "Pimentel-Nunes P, Dinis-Ribeiro M, Soares JB et al. A multicenter validation of an endoscopic classification with narrow band imaging for gastric precancerous and cancerous lesions. Endoscopy 2012; 44: 236 \u2013 246. doi:10.1055/s-0031-1291537",
      "doi": "10.1055/s-0031-1291537"
    },
    {
      "id": "ref-14",
      "citation": "Pimentel-Nunes P, Libanio D, Lage J et al. A multicenter prospective study of the real-time use of narrow-band imaging in the diagnosis of premalignant gastric conditions and lesions. Endoscopy 2016; 48: 723 \u2013 730. doi:10.1055/s-0042-108435",
      "doi": "10.1055/s-0042-108435"
    },
    {
      "id": "ref-15",
      "citation": "Yao K, Anagnostopoulos GK, Ragunath K. Magnifying endoscopy for diagnosing and delineating early gastric cancer. Endoscopy 2009; 41: 462 \u2013 467. doi:10.1055/s-0029-1214594",
      "doi": "10.1055/s-0029-1214594"
    },
    {
      "id": "ref-16",
      "citation": "Yao K, Oishi T, Matsui T et al. Novel magnified endoscopic findings of microvascular architecture in intramucosal gastric cancer. Gastrointest Endosc 2002; 56: 279 \u2013 284. doi:10.1067/mge.2002.126061",
      "doi": "10.1067/mge.2002.126061"
    },
    {
      "id": "ref-17",
      "citation": "Abe S, Oda I, Shimazu T et al. Depth-predicting score for differentiated early gastric cancer. Gastric Cancer 2011; 14: 35\u2013 40. doi:10.1007/s10120-011-0002-z",
      "doi": "10.1007/s10120-011-0002-z"
    },
    {
      "id": "ref-18",
      "citation": "Kudo S, Rubio CA, Teixeira CR et al. Pit pattern in colorectal neoplasia: endoscopic magnifying view. Endoscopy 2001; 33: 367\u2013 373. doi:10.1055/s-2004-826104",
      "doi": "10.1055/s-2004-826104",
      "lowConfidence": true,
      "confidenceIssues": [
        "year 2001 vs match year 2004"
      ]
    },
    {
      "id": "ref-19",
      "citation": "Hayashi N, Tanaka S, Hewett DG et al. Endoscopic prediction of deep submucosal invasive carcinoma: validation of the narrow-band imaging international colorectal endoscopic (NICE) classification. Gastrointest Endosc 2013; 78: 625 \u2013 632. doi:10.1016/j.gie.2013.04.185",
      "doi": "10.1016/j.gie.2013.04.185"
    },
    {
      "id": "ref-20",
      "citation": "Iwatate M, Sano Y, Tanaka S et al. Validation study for development of the Japan NBI Expert Team classification of colorectal lesions. Dig Endosc 2018; 30: 642 \u2013 651. doi:10.1111/den.13065",
      "doi": "10.1111/den.13065"
    },
    {
      "id": "ref-21",
      "citation": "Sumimoto K, Tanaka S, Shigita K et al. Clinical impact and characteristics of the narrow-band imaging magnifying endoscopic classification of colorectal tumors proposed by the Japan NBI Expert Team. Gastrointest Endosc 2017; 85: 816 \u2013 821. doi:10.1016/j.gie.2016.07.035",